{
  "version": 1,
  "request": "Lelouch's grand speech",
  "title": "Zero Requiem: The Demon Emperor's Final Address",
  "segments": [
    {
      "start": 873.71,
      "end": 891.48,
      "note": "The Emperor's parade begins: prisoners in chains, Knightmares lining the road. Sets the stage for his speech."
    },
    {
      "start": 934.27,
      "end": 948.41,
      "note": "Lelouch on his throne atop the float, in full command, as the procession moves on."
    },
    {
      "start": 1035.08,
      "end": 1058.72,
      "note": "Lelouch rises from the throne and speaks his last address from the float. Close-ups build up to Zero's arrival."
    },
    {
      "start": 1058.72,
      "end": 1105.2,
      "note": "Zero charges the float and Lelouch meets him. The speech ends in the sword strike that completes the Zero Requiem."
    },
    {
      "start": 1105.2,
      "end": 1149.28,
      "note": "Lelouch's last words, Nunnally realizing what he did, and the crowd's cry. The emotional end of the speech."
    }
  ],
  "metadata": {
    "mood": "grand, tragic, operatic",
    "characters": [
      "Lelouch vi Britannia",
      "Nunnally",
      "Suzaku (Zero)",
      "Kallen",
      "C.C."
    ]
  }
}